<?xml version="1.0" encoding="UTF-8"?>
<book xmlns:xsi="http://www.w3.org/2001/XMLSchema-instance" xsi:schemaLocation="http://ebay.in/sales/books file:///D:/work/master/webservices/20180125/Xml/xsd/namespaces/book.xsd" xmlns="http://ebay.in/sales/books">
	<isbn>isb3</isbn>
	<title>393</title>
	<author>
		<name>yaswanth</name>
		<dob>1990-01-23</dob>
	</author>
	<publisher>
		<name>wrox</name>
		<est-date>1980-01-01</est-date>
	</publisher>
</book>